<?xml version="1.0" encoding="UTF-8"?>
<article xmlns:xsi="http://www.w3.org/2001/XMLSchema-instance"
  xsi:noNamespaceSchemaLocation="../../../../article.xsd"
  id="drupal-8-authentication-api"
  created="2018-01-19T19:17:14"
  updated="2024-11-30T00:00:00">
  <translations>
    <translation language="ru" primary="true" src="./article.ru.md">
      <title>Drupal 8: Authentication API — создание Authentication Provider</title>
      <description>
        Узнайте, как создавать собственные сервисы аутентификации в Drupal 8.
        Научитесь добавлять новые способы авторизации, такие как авторизация
        через API ключ, автоматическая авторизация с определённых IP-адресов и
        другие.
      </description>
      <poster src="./image/poster.ru.png"/>
    </translation>
  </translations>
  <tags>
    <tag>drupal</tag>
    <tag>drupal-8</tag>
  </tags>
</article>