<?xml version="1.0" encoding="UTF-8"?>
<article xmlns:xsi="http://www.w3.org/2001/XMLSchema-instance"
  xsi:noNamespaceSchemaLocation="../../../../article.xsd"
  id="drupal-8-tour-api"
  created="2015-11-04T12:05:27"
  updated="2024-11-30T00:00:00">
  <translations>
    <translation language="ru" primary="true" src="./article.ru.md">
      <title>Drupal 8: Tour API</title>
      <description>
        Drupal 8 Tour API позволяет создавать интерактивные туры по
        административным страницам, предоставляя редакторам наглядные обучающие
        подсказки.
      </description>
      <poster src="./image/poster.png"/>
    </translation>
  </translations>
  <tags>
    <tag>drupal</tag>
    <tag>drupal-8</tag>
  </tags>
</article>