<?xml version="1.0" encoding="UTF-8"?>
<article xmlns:xsi="http://www.w3.org/2001/XMLSchema-instance"
  xsi:noNamespaceSchemaLocation="../../../../article.xsd"
  id="drupal-7-integrating-color-module-guide"
  created="2013-04-17T14:45:40"
  updated="2025-07-17T00:00:00">
  <translations>
    <translation language="ru" primary="true" src="./article.ru.md">
      <title>Интеграция color-модуля в тему Drupal 7: подробное руководство</title>
      <description>Добавьте в свою тему поддержку Color-модуля и легко меняйте цвета!</description>
      <poster src="./image/poster.ru.png"/>
    </translation>
  </translations>
  <tags>
    <tag>drupal</tag>
    <tag>drupal-7</tag>
  </tags>
</article>