<?xml version="1.0" encoding="UTF-8"?>
<article xmlns:xsi="http://www.w3.org/2001/XMLSchema-instance"
  xsi:noNamespaceSchemaLocation="../../../../article.xsd"
  id="mappy-7.x-1.4-8.x-1.0-rc1"
  created="2014-10-10T19:02:30"
  updated="2025-07-17T00:00:00">
  <translations>
    <translation language="ru" primary="true" src="./article.ru.md">
      <title>Mappy: 7.x-1.4 / 8.x-1.0-rc1</title>
      <description>Список изменений.</description>
      <poster src="./image/poster.ru.png"/>
    </translation>
  </translations>
  <tags>
    <tag>drupal</tag>
    <tag>drupal-7</tag>
    <tag>drupal-8</tag>
  </tags>
</article>