<?xml version="1.0" encoding="UTF-8"?>
<article xmlns:xsi="http://www.w3.org/2001/XMLSchema-instance"
  xsi:noNamespaceSchemaLocation="../../../../article.xsd"
  id="drupal-8-configuration-schema"
  created="2018-05-04T17:57:03"
  updated="2024-11-30T00:00:00">
  <translations>
    <translation language="ru" primary="true" src="./article.ru.md">
      <title>Drupal 8: Configuration Schema</title>
      <description>
        Узнайте, как создавать схемы для конфигурационных файлов в Drupal 8.
      </description>
      <poster src="./image/poster.png"/>
    </translation>
  </translations>
  <tags>
    <tag>drupal</tag>
    <tag>drupal-8</tag>
  </tags>
</article>