<?xml version="1.0" encoding="UTF-8"?>
<article xmlns:xsi="http://www.w3.org/2001/XMLSchema-instance"
  xsi:noNamespaceSchemaLocation="../../../../article.xsd"
  id="drupal-7-for-beginners-taxonomy"
  created="2013-02-04T23:11:39"
  updated="2025-07-17T00:00:00">
  <translations>
    <translation language="ru" primary="true" src="./article.ru.md">
      <title>Drupal 7 для начинающих: Таксономия</title>
      <description>Разбираемся со словарями.</description>
      <poster src="./image/poster.ru.png"/>
    </translation>
  </translations>
  <tags>
    <tag>drupal</tag>
    <tag>drupal-7</tag>
  </tags>
</article>