<?xml version="1.0" encoding="UTF-8"?>
<article xmlns:xsi="http://www.w3.org/2001/XMLSchema-instance"
  xsi:noNamespaceSchemaLocation="../../../../article.xsd"
  id="drupal-8-9-sending-emails-using-oop-and-dependency-injection"
  created="2020-05-29T14:47:23"
  updated="2024-11-30T00:00:00">
  <translations>
    <translation language="ru" primary="true" src="./article.ru.md">
      <title>Drupal 8, 9: Отправка писем используя ООП и Dependency Injection</title>
      <description>
        Узнайте, как отправлять письма в Drupal 8 и 9 с использованием ООП и
        Dependency Injection для улучшения структуры кода и удобства разработки.
      </description>
      <poster src="./image/poster.ru.png"/>
    </translation>
  </translations>
  <tags>
    <tag>drupal</tag>
    <tag>drupal-8</tag>
    <tag>drupal-9</tag>
  </tags>
</article>