<?xml version="1.0" encoding="UTF-8"?>
<article xmlns:xsi="http://www.w3.org/2001/XMLSchema-instance"
  xsi:noNamespaceSchemaLocation="../../../../article.xsd"
  id="drupal-8-how-to-create-custom-plugin-type"
  created="2016-09-17T13:39:21"
  updated="2025-07-17T00:00:00">
  <translations>
    <translation language="ru" primary="true" src="./article.ru.md">
      <title>Drupal 8: Plugin API — создание собственных типов плагинов</title>
      <description>
        Узнайте, как создавать собственные типы плагинов в Drupal 8. Это
        позволит вам расширить функциональность вашего сайта и добавить новые
        возможности.
      </description>
      <poster src="./image/poster.ru.png"/>
      <attachments>
        <attachment src="./attachment/custom_csv_import_article.csv"
          title="Заготовка для теста импорта статей"/>
        <attachment src="./attachment/custom_csv_import_page.csv"
          title="Заготовка для теста импорта страниц"/>
      </attachments>
    </translation>
  </translations>
  <tags>
    <tag>drupal</tag>
    <tag>drupal-8</tag>
  </tags>
</article>