<?xml version="1.0" encoding="UTF-8"?>
<article xmlns:xsi="http://www.w3.org/2001/XMLSchema-instance"
  xsi:noNamespaceSchemaLocation="../../../../article.xsd"
  id="drupal-8-9-lock-and-lock-persistent"
  created="2020-04-30T14:13:22"
  updated="2024-11-30T00:00:00">
  <translations>
    <translation language="ru" primary="true" src="./article.ru.md">
      <title>Drupal 8, 9: lock и lock.persistent — блокировка состояния</title>
      <description>
        Drupal 8, 9: блокировка состояния — узнайте, как обеспечить целостность
        данных, предотвратить конфликты при работе с сайтом и избежать
        «состояние гонки».
      </description>
      <poster src="./image/poster.ru.png"/>
    </translation>
  </translations>
  <tags>
    <tag>drupal</tag>
    <tag>drupal-8</tag>
    <tag>drupal-9</tag>
  </tags>
</article>