<?xml version="1.0" encoding="UTF-8"?>
<article xmlns:xsi="http://www.w3.org/2001/XMLSchema-instance"
  xsi:noNamespaceSchemaLocation="../../../../article.xsd"
  id="ubuntu-12-web-server"
  created="2012-12-31T22:39:23"
  updated="2024-11-30T00:00:00">
  <translations>
    <translation language="ru" primary="true" src="./article.ru.md">
      <title>Установка веб-сервера на Ubuntu 12.x</title>
      <description>Подготавливаем локальный веб-сервер для разработки на Ubuntu 12.x.</description>
      <poster src="./image/poster.ru.png"/>
      <attachments>
        <attachment src="./attachment/add_alias.sh.zip" title="Скрипт добавления алиасов"/>
        <attachment src="./attachment/add_alias_indomain13-10.sh.zip" title="Скрипт добавления алиасов Ubuntu 13.10"/>
      </attachments>
    </translation>
  </translations>
  <tags>
    <tag>ubuntu</tag>
    <tag>linux</tag>
    <tag>web_server</tag>
  </tags>
</article>