<?xml version="1.0" encoding="UTF-8"?>
<article xmlns:xsi="http://www.w3.org/2001/XMLSchema-instance"
  xsi:noNamespaceSchemaLocation="../../../../article.xsd"
  id="drupal-8-how-to-create-a-custom-views-field-handler"
  created="2017-07-26T18:51:00"
  updated="2025-07-17T00:00:00">
  <translations>
    <translation language="ru" primary="true" src="./article.ru.md">
      <title>Drupal 8 Views Field Handler Plugin — собственные поля для Views</title>
      <description>
        Руководство по добавлению собственных полей в модуль Views.
      </description>
      <poster src="./image/poster.ru.png"/>
    </translation>
  </translations>
  <tags>
    <tag>drupal</tag>
    <tag>drupal-8</tag>
    <tag>performance</tag>
  </tags>
</article>