<?xml version="1.0" encoding="UTF-8"?>
<article xmlns:xsi="http://www.w3.org/2001/XMLSchema-instance"
  xsi:noNamespaceSchemaLocation="../../../../article.xsd"
  id="how-to-group-content-in-views"
  created="2016-09-02T08:06:03"
  updated="2025-07-17T00:00:00">
  <translations>
    <translation language="ru" primary="true" src="./article.ru.md">
      <title>Drupal - группировка материалов во Views</title>
      <description>
        Узнайте, как объединять элементы по определённому признаку для улучшения
        структуры и навигации вашего сайта.
      </description>
      <poster src="./image/poster.ru.png"/>
    </translation>
  </translations>
  <tags>
    <tag>drupal</tag>
    <tag>drupal-7</tag>
    <tag>drupal-8</tag>
  </tags>
</article>