<?xml version="1.0" encoding="UTF-8"?>
<article xmlns:xsi="http://www.w3.org/2001/XMLSchema-instance"
  xsi:noNamespaceSchemaLocation="../../../../article.xsd"
  id="drupal-7-for-beginners-modules"
  created="2013-02-14T12:00:30"
  updated="2025-07-17T00:00:00">
  <translations>
    <translation language="ru" primary="true" src="./article.ru.md">
      <title>Drupal 7 для начинающих: Модули</title>
      <description>Разбираемся с модулями в Drupal 7.</description>
      <poster src="./image/poster.ru.png"/>
      <attachments>
        <attachment src="./attachment/dfbeginners.tar.gz"
          title="Результат выполнения"/>
      </attachments>
    </translation>
  </translations>
  <tags>
    <tag>drupal</tag>
    <tag>drupal-7</tag>
  </tags>
</article>