<?xml version="1.0" encoding="UTF-8"?>
<article xmlns:xsi="http://www.w3.org/2001/XMLSchema-instance"
  xsi:noNamespaceSchemaLocation="../../../../article.xsd"
  id="drupal-7-views-grid-formatting-with-divs"
  created="2013-04-20T18:32:13"
  updated="2024-11-30T00:00:00">
  <translations>
    <translation language="ru" primary="true" src="./article.ru.md">
      <title>Форматирование вывода Views в виде сетки на Drupal 7 с использованием div-элементов</title>
      <description>Узнайте, как использовать div-элементы для вывода сетки Views и обеспечения адаптивности дизайна.</description>
      <poster src="./image/poster.ru.png"/>
    </translation>
  </translations>
  <tags>
    <tag>drupal</tag>
    <tag>drupal-7</tag>
  </tags>
</article>